ファイル名,説明文
k22001-タオル-0001-01.jpg,えんじ色のROOT66のマフラータオル
k22001-タオル-0002-01.jpg,グリーンの水玉のハンドタオル
k22001-タオル-0002-02.jpg,グリーンの水玉のハンドタオル
k22001-タオル-0003-01.jpg,水色の花柄のハンドタオル
k22001-タオル-0003-02.jpg,水色の花柄のハンドタオル
k22001-タオル-0004-01.jpg,黄緑色の花柄のハンドタオル
k22001-タオル-0004-02.jpg,黄緑色の花柄のハンドタオル
k22001-タオル-0005-01.jpg,ピンクの格子模様のハンドタオル
k22001-タオル-0006-01.jpg,グレーのadidasのマフラータオル
k22001-タオル-0006-02.jpg,グレーのadidasのマフラータオル
k22001-タオル-0007-01.jpg,紫の佐藤輝明のタオル
k22001-タオル-0008-01 .jpg,白の阪神タイガースのタオル
C23078-タオル-0001-01 .jpg,白地に黒の枠線で囲まれた英語が書かれてるスヌーピーのタオル(表面)
C23078-タオル-0001-02 .jpg,白地に黒の枠線で囲まれた英語が書かれてるスヌーピーのタオル(裏面)
C23078-タオル-0002-01.jpg,緑地に黄色の枠線で囲まれたタオル「Mrs.Green」と書かれている
C23078-タオル-0002-02.jpg,緑地に黄色の枠線で囲まれたタオル「Apple」と書かれている
C23078-タオル-0002-03.jpg,緑地に黄色の枠線で囲まれたタオル「Mrs.Green Apple」と書かれている
C23078-タオル-0003-01.jpg,白地の長タオル、赤文字で大きく「CHALLENGE」と書かれており、その下に「円心會館」と漢字が書かれている。
C23078-タオル-0004-01.jpg,白地のタオルハンカチ、右下に愛媛県のゆるキャラであるミキャンが刺繍されている。
C23078-タオル-0004-01.jpg,真ん中にオレンジ色の文字で「Boo!Boo!Baa!」と書かれている蒼井翔太のファンクラブイベントのタオル
B23026-タオル-0001-01.jpg,ディズニーの35周年の長いタオル
B23026-タオル-0001-02.jpg,ディズニーの35周年の長いタオル、裏地に金色の模様がある
B23026-タオル-0002-01.jpg,白い麻っぽい素材のハンドタオル
B23014-タオル-0001-01.jpg,紫、黒、白のサンフレッチェ広島のタオル　エンブレム付き
B23014-タオル-0002-01.jpg,紫のサンフレッチェ広島のタオル　エンブレム付き　9番ドウグラスヴィエイラと書かれている
B23014-タオル-0003-01.jpg,黒のアディダスのハンカチ
B23014-タオル-0004-01.jpg,赤ベースに白と黄色のムンクの刺繡付き、「The Scream Edyard Munch」と刺繍されている
B23014-タオル-0005-01.jpg,ミニオンのハンカチ
B23014-タオル0006-01.jpg,ピンクと紫のハート柄付きのデイジーのタオル
B23014-タオル-0007-01.jpg,黒、赤、茶色、白、橙色、オレンジのグレムリンのタオル　赤字で「GREMLiNS」と書いてある
B23028-タオル0007-01.jpg,灰色のタオル、コットン製で人気の商品
B23048-タオル-0001-01.jpg,ジェラトーニとミャクミャクのハンカチ
B23056-タオル-0001.JPG,白色とピンク色でミッキーとミニーがたくさん描かれているタオル
B23056-タオル-0002.JPG,ピンク色でこびとづかんのモモジリのイラストが描かれているタオル
B23056-タオル-0003.JPG,赤色のタオルで右下に黄色で「はるか」と刺繡されている
B23056-タオル-0004.JPG,青色 基調でおぱんちゅうさぎのイラストが描かれている正方形のタオル
B23056-タオル-0005.JPG,ティンガー・ベルのイラストが描かれているタオル
B23056-タオル-0006.JPG,ピンク色で女の子が風船ガムを膨らませているイラストで「Do you？」とたくさん描かれているタオル
B23056-タオル-0007.JPG,Francfrancの白色のハンドタオル
B23056-タオル-0008.JPG,Francfrancのライトグリーン色で右下にグレーのりぼんがあるハンドタオル
B23056-タオル-0009.JPG,Francfrancの紺色基調で周りが白色で刺繡されているハンドタオル
B23048-タオル-0003-01.jpg,ピンクと青の細長いタオル　NAKAMAとかかれている
B23056-タオル-0010.JPG,黄色基調でピンク色のウサギのイラストと「ばにー」とたくさん描かれているタオル
B23056-タオル-0011.JPG,ダッフィー＆フレンズのイラストが描かれているタオル
25G355-タオル-0001-01.jpg,ピンク色のハンドタオル
25G355-タオル-0001-02.jpg,ピンク色のハンドタオル　リンゴとパパイヤのアップリケ付き
25G355-タオル-0004-02.jpg,白色のハンドタオル　紫と濃い茶色の柄
25G355-タオル-0003-01.jpg,白色のガーゼタオル　妖怪柄
25G355-タオル-0003-01.jpg,白色のガーゼタオル　妖怪柄
25G355-タオル-0004-01.jpg,ベージュ色のダリア柄のハンドタオル
25G355-タオル-0004-01.jpg,ベージュ色のダリア柄のハンドタオル　紺色ダリア
25G355-タオル-0005-01.jpg,緑色のハンドタオル　パンダ柄
25G355-タオル-0005-02.jpg,緑色のハンドタオル　パンダ柄
25G355-タオル-0006-01.jpg,白色フグ柄ガーゼタオル
25G355-タオル-0006-02.jpg,白色フグ柄ガーゼタオル　「SHIMONOSEKI」文字入り
25G355-タオル-0007-01.jpg,薄黄色のハンドタオル　チェリー柄　「SONIA RYKIEL」文字入
25G355-タオル-0008-01.jpg,ピンク色吸水タオ
25G355-タオル-0008-02.jpg,ピンク色吸水タオル
25G355-タオル-0009-01.jpg,白色に青と赤のドット柄入りタオル　縁が赤と青
25G355-タオル-0009-02.jpg,白色に青と赤のドット柄入りタオル　縁が赤と青
25G355-タオル-0010-01.jpg,薄緑色のタオル　端に文字の「HB]の刺繍入り　濃い緑の縁飾り付き
25G355-タオル-0010-02.jpg,薄緑色のタオル　端に文字の「HB]の刺繍入り　濃い緑の縁飾り付き
25G355-タオル-0011-01.jpg,白色のタオル　飛行機柄
25G355-タオル-0012-01.jpg,白色に赤と黒の梅柄ガーゼタオル　和風
25G355-タオル-0012-02.jpg,白色に赤と黒の梅柄ガーゼタオル　和風
25G355-タオル-0013-01.jpg,ストライプ　緑紺黄赤水オレンジ色のタオル
25G355-タオル-0013-02.jpg,ストライプ　紺黄赤水色のタオル
25G355-タオル-0014-01.jpg,紫色　白まる柄タオル
25G355-タオル-0014-02.jpg,紫色　白まる柄タオル
25G355-タオル-0015-01.jpg,白色に青の和柄タオル
25G355-タオル-0015-02.jpg,白色に青のドット柄タオル
25G355-タオル-0016-01.jpg,黄色のハチ柄ハンドタオル
25G355-タオル-0016-02.jpg,黄色のハチ柄タオル
25G355-タオル-0017-01.jpg,白色に北欧柄タオル
25G355-タオル-0017-02.jpg,白色に北欧柄タオル
B23048-タオル-0003-01.jpg,長タオル　黒　字は緑　「VVSixTONES」と書かれている
